{
  "automatic_estimand_selection_included": false,
  "cluster_superpopulation_resampling_included": false,
  "delete_mj_estimand_correction_claimed": false,
  "direction_threshold": 0.5,
  "fixed_block_profiles_across_replicates": true,
  "primary_metric": "observed_favorable_rate",
  "reference_log_imor": -1.996553881874,
  "report_fingerprint": "1b0d6a6d8b4bead1b5ad06df5b83dac1296f1be39d072feb6de25bdd7aab8eda",
  "scenarios": [
    {
      "cluster_balanced_favorable_prevalence": 0.5,
      "cluster_balanced_reference_direction": "at",
      "cluster_count": 12,
      "favorable_prevalence_contrast_unit_minus_cluster": 0.0,
      "maximum_cluster_fraction": 0.083333333333,
      "maximum_cluster_size": 128,
      "methods": [
        {
          "all_metric_calibration_targets_met": true,
          "influence_basis": "leave_one_out_shift",
          "largest_block_deletion_direction_flip": {
            "event_count": 0,
            "lower": null,
            "rate": null,
            "total_count": 0,
            "upper": null
          },
          "mean_maximum_absolute_influence": 0.020226177743,
          "mean_maximum_absolute_influence_share": 0.203124817474,
          "method": "unit_weighted_delete_one_student_t",
          "p95_maximum_absolute_influence": 0.029195979675,
          "reference_alternate_estimand_bias": -0.000337593217,
          "reference_alternate_truth": 0.5,
          "reference_calibration_target_met": true,
          "reference_interval_yield": {
            "event_count": 500,
            "lower": 0.992375659538,
            "rate": 1.0,
            "total_count": 500,
            "upper": 1.0
          },
          "reference_mean_estimate": 0.499662406783,
          "reference_standard_error_to_empirical_sd_ratio": 1.004746813546,
          "reference_target_bias": -0.000337593217,
          "reference_target_coverage": {
            "event_count": 472,
            "lower": 0.920255206353,
            "rate": 0.944,
            "total_count": 500,
            "upper": 0.960974379317
          },
          "reference_target_truth": 0.5,
          "target_estimand": "unit_weighted",
          "unique_largest_block_most_influential": {
            "event_count": 0,
            "lower": null,
            "rate": null,
            "total_count": 0,
            "upper": null
          }
        },
        {
          "all_metric_calibration_targets_met": true,
          "influence_basis": "pseudovalue_contribution",
          "largest_block_deletion_direction_flip": {
            "event_count": 0,
            "lower": null,
            "rate": null,
            "total_count": 0,
            "upper": null
          },
          "mean_maximum_absolute_influence": 0.018540662931,
          "mean_maximum_absolute_influence_share": 0.203124817474,
          "method": "unit_weighted_delete_mj_student_t",
          "p95_maximum_absolute_influence": 0.026762981368,
          "reference_alternate_estimand_bias": -0.000337593217,
          "reference_alternate_truth": 0.5,
          "reference_calibration_target_met": true,
          "reference_interval_yield": {
            "event_count": 500,
            "lower": 0.992375659538,
            "rate": 1.0,
            "total_count": 500,
            "upper": 1.0
          },
          "reference_mean_estimate": 0.499662406783,
          "reference_standard_error_to_empirical_sd_ratio": 1.004746813546,
          "reference_target_bias": -0.000337593217,
          "reference_target_coverage": {
            "event_count": 472,
            "lower": 0.920255206353,
            "rate": 0.944,
            "total_count": 500,
            "upper": 0.960974379317
          },
          "reference_target_truth": 0.5,
          "target_estimand": "unit_weighted",
          "unique_largest_block_most_influential": {
            "event_count": 0,
            "lower": null,
            "rate": null,
            "total_count": 0,
            "upper": null
          }
        },
        {
          "all_metric_calibration_targets_met": true,
          "influence_basis": "leave_one_out_shift",
          "largest_block_deletion_direction_flip": {
            "event_count": 0,
            "lower": null,
            "rate": null,
            "total_count": 0,
            "upper": null
          },
          "mean_maximum_absolute_influence": 0.020226177743,
          "mean_maximum_absolute_influence_share": 0.203124817474,
          "method": "cluster_balanced_delete_one_student_t",
          "p95_maximum_absolute_influence": 0.029195979675,
          "reference_alternate_estimand_bias": -0.000337593217,
          "reference_alternate_truth": 0.5,
          "reference_calibration_target_met": true,
          "reference_interval_yield": {
            "event_count": 500,
            "lower": 0.992375659538,
            "rate": 1.0,
            "total_count": 500,
            "upper": 1.0
          },
          "reference_mean_estimate": 0.499662406783,
          "reference_standard_error_to_empirical_sd_ratio": 1.004746813546,
          "reference_target_bias": -0.000337593217,
          "reference_target_coverage": {
            "event_count": 472,
            "lower": 0.920255206353,
            "rate": 0.944,
            "total_count": 500,
            "upper": 0.960974379317
          },
          "reference_target_truth": 0.5,
          "target_estimand": "cluster_balanced",
          "unique_largest_block_most_influential": {
            "event_count": 0,
            "lower": null,
            "rate": null,
            "total_count": 0,
            "upper": null
          }
        }
      ],
      "minimum_cluster_size": 128,
      "production_eligible": true,
      "production_ineligibility_reasons": [],
      "scenario_id": "balanced-null-12",
      "size_outcome_correlation": null,
      "size_outcome_covariance": 0.0,
      "truth_direction_disagrees": false,
      "unit_weighted_favorable_prevalence": 0.5,
      "unit_weighted_reference_direction": "at"
    },
    {
      "cluster_balanced_favorable_prevalence": 0.475,
      "cluster_balanced_reference_direction": "below",
      "cluster_count": 12,
      "favorable_prevalence_contrast_unit_minus_cluster": 0.055,
      "maximum_cluster_fraction": 0.266666666667,
      "maximum_cluster_size": 512,
      "methods": [
        {
          "all_metric_calibration_targets_met": false,
          "influence_basis": "leave_one_out_shift",
          "largest_block_deletion_direction_flip": {
            "event_count": 342,
            "lower": 0.64197787083,
            "rate": 0.684,
            "total_count": 500,
            "upper": 0.72321637188
          },
          "mean_maximum_absolute_influence": 0.079445624633,
          "mean_maximum_absolute_influence_share": 0.452022886182,
          "method": "unit_weighted_delete_one_student_t",
          "p95_maximum_absolute_influence": 0.12245511576,
          "reference_alternate_estimand_bias": 0.054610304287,
          "reference_alternate_truth": 0.475,
          "reference_calibration_target_met": false,
          "reference_interval_yield": {
            "event_count": 500,
            "lower": 0.992375659538,
            "rate": 1.0,
            "total_count": 500,
            "upper": 1.0
          },
          "reference_mean_estimate": 0.529610304287,
          "reference_standard_error_to_empirical_sd_ratio": 2.31595876144,
          "reference_target_bias": -0.000389695713,
          "reference_target_coverage": {
            "event_count": 491,
            "lower": 0.966148329091,
            "rate": 0.982,
            "total_count": 500,
            "upper": 0.990501806704
          },
          "reference_target_truth": 0.53,
          "target_estimand": "unit_weighted",
          "unique_largest_block_most_influential": {
            "event_count": 487,
            "lower": 0.956028509166,
            "rate": 0.974,
            "total_count": 500,
            "upper": 0.984743616077
          }
        },
        {
          "all_metric_calibration_targets_met": false,
          "influence_basis": "pseudovalue_contribution",
          "largest_block_deletion_direction_flip": {
            "event_count": 0,
            "lower": null,
            "rate": null,
            "total_count": 0,
            "upper": null
          },
          "mean_maximum_absolute_influence": 0.058379908936,
          "mean_maximum_absolute_influence_share": 0.396184993009,
          "method": "unit_weighted_delete_mj_student_t",
          "p95_maximum_absolute_influence": 0.089800418224,
          "reference_alternate_estimand_bias": 0.054610304287,
          "reference_alternate_truth": 0.475,
          "reference_calibration_target_met": false,
          "reference_interval_yield": {
            "event_count": 500,
            "lower": 0.992375659538,
            "rate": 1.0,
            "total_count": 500,
            "upper": 1.0
          },
          "reference_mean_estimate": 0.529610304287,
          "reference_standard_error_to_empirical_sd_ratio": 1.45456199352,
          "reference_target_bias": -0.000389695713,
          "reference_target_coverage": {
            "event_count": 488,
            "lower": 0.958522942536,
            "rate": 0.976,
            "total_count": 500,
            "upper": 0.986218685345
          },
          "reference_target_truth": 0.53,
          "target_estimand": "unit_weighted",
          "unique_largest_block_most_influential": {
            "event_count": 481,
            "lower": 0.941415227469,
            "rate": 0.962,
            "total_count": 500,
            "upper": 0.975539881944
          }
        },
        {
          "all_metric_calibration_targets_met": true,
          "influence_basis": "leave_one_out_shift",
          "largest_block_deletion_direction_flip": {
            "event_count": 71,
            "lower": 0.114129360446,
            "rate": 0.142,
            "total_count": 500,